,authors,cite_by,description,publication_date,tittle
135,"S Babel, A Haarstrick, MS Babel, A Sharp", ,"Recent advances of microplastic (MP) studies in Japan are reviewed. To standardize and to harmonize the oceanic MP measurement, the Ministry of Environment, Japan recently opened a guideline publicly on their website. In line with the protocols in the guideline, the situation was uncovered that the East Asian seas are located in a hotspot of marine plastic pollution, and the situation will continue in the future unless the mismanaged plastic waste is drastically reduced around these regions.",2019/10/24,RECENT ADVANCES IN MICROPLASTIC RESEARCH IN JAPAN
136,"S Babel, A Haarstrick, MS Babel, A Sharp", ,"This study contributes to understand plastic governance and analyzes governance initiatives to address plastic pollution. Plastic pollution has become a challenge for the world especially for marine life and steps are being taken from global to the local scale to address this issue. However, there are multiple challenges and policy implementation gaps to effectively address the issue of plastic pollution. This study is conducted to understand the governance problems and to uncover the implementation challenges. The study also identifies the drivers behind the existing challenges for plastic governance. The study is conducted by employing literature review as research methodology. The study finds that transboundary and multi-level governance approaches are in place to manage the issue. The study finds that the focus of governance initiatives remained mainly at regional or national scale during the first decade of this century. However, on the heels of Paris Agreement 2015, the role of local governments and civil society are recognized to deal with the issue of climate change including plastic pollution. This shift of governance to the local scale gave birth to adaptive form of governance. This governance strategy is equipped to involve all the relevant local stakeholders including media and civil society organizations and to mobilize youth to tackle the issue of plastic pollution. Despite these positive governance initiatives, certain challenges for the existing governance mechanisms are identified. Lack of cooperation among transboundary communities, different political interests, weak institutional capacity and scarcity of financial resources especially …",2019/10/24,"MICROPLASTICS CHALLENGES AND INTERNATIONAL GOVERNANCE MECHANISMS Muhammad Mumtaz1, Jose A. Puppim de Oliveira 2, Ishfaq Ahmed 3"
137,"S Babel, A Haarstrick, MS Babel, A Sharp", ,"Microplastics (MPs) are ubiquitously found all over the world, from densely populated areas to remote ones. The presence of MPs poses a great threat to the entire ecosystem. The pollutants mainly come from daily use products such as cosmetics, paints, etc.(primary MPs); or the breakdown of larger macroplastic debris under environmental conditions (secondary MPs). MPs enter aquatic environments through terrestrial and land-based activities. Since the last few decades, about 93-236 thousand metric tonnes of MP particles have accumulated in the marine environment due to improper disposal of waste plastics. With this situation, this paper reviews sources of MPs and the existing state of MPs in the marine and freshwater environments. In marine environment, MPs are found in their highest concentrations along coastlines and within mid-ocean gyres. Fiber and fragment are the majority morphologies of MPs found in oceans. While a large number of studies on MPs have focused on the marine environment, few are reported in the freshwater environment.",2019/10/24,CURRENT STATUS OF MICROPLASTICS CONTAMINATION IN MARINE AND FRESHWATER ENVIRONMENTS
138,"S Babel, A Haarstrick, MS Babel, A Sharp", ,"Microplastics (MPs) are present in high densities in estuaries, where they become easily available to the biota. The aim of this study was to describe a methodology developed to study the relationship among the spatio-temporal patterns of habitat utilization, feeding ecology and MPs contamination across the different ontogenetic phases of fishes belonging to different trophic levels and living along the riverine-estuarine-coastal food chain (ecocline) of a tropical environment case study (Goiana Estuary). The water column of Goiana Estuary was examined for the seasonal and spatial variation of MPs (< 5 mm) and their quantification relative to zooplankton and demersal fish species contamination following the same sampling design. The fish species were assigned to different size classes (juvenile, sub-adult and adult). A total mean of 13.7 x103/m3 (Zooplankton: 99%, Ichthyoplankton: 0.6%, microplastics: 0.2%) were captured in the seston. The highest amounts of MPs were observed during the late rainy season. The density of MPs in the water column determines their bioavailability to plankton feeders, and then to larger predators. This process possibly promotes the transfer of MPs between trophic levels. Polyamide (Nylon) and polyethylene blue fibres were the most frequent types of MPs found in the estuary. Their presence could possibly be linked to nets and cables used in fisheries and other maritime operations. Juveniles of socio-economically important species (Cynoscion acoupa ʹ Acoupa weakfish and Centropomus undecimalis-Snooks) occur in the upper estuary, an important nursery ground during the early rainy season. Sub-adults …",2019/10/24,SAMPLING STRATEGY TO CONDUCT STUDIES ON SPATIAL AND TEMPORAL CONTAMINATION OF MICROPLASTICS IN ESTUARINE ECOSYSTEMS
139,"Jakkapon Phanthuwongpakdee, Sumant Dwivedi, Kenji Takada, Sandhya Babel, Tatsuo Kaneko", , ,2019/8/25,Design and syntheses of bio-based exotic amino acid derived cationic polyamide for the application of water treatment
140,"Sandhya Babel, Sri Hartuti, Hiroshi Onishi, Nobuyuki Ichikuni", ,"Strontium titanate, SrTiO3, with the perovskite ABO3 structure is known as one of the most efficient photocatalyst materials for the overall water splitting reaction. Doping with appropriate metal cations at the A site or at the B site substantially increases the quantum yield to split water into H2 and O2. The site occupied by the guest dopant in the SrTiO3 host thus plays a key role in dictating the water splitting activity. However, little is known about the detailed structure of the dopant site in the host lattice. In this study, the local structure of In³⁺ cations, which were shown to improve the water splitting activity of SrTiO3, is investigated with X-ray absorption fine structure spectroscopy and density functional theory (DFT) calculations. The In³⁺ cations exclusively substitute for Ti⁴⁺ cations at the B site to form InO6 octahedra. Further optical experiments using UV-Vis diffuse reflectance spectroscopy and DFT calculations of the density of states indicate that the substitution of In³⁺ for Ti⁴⁺ does not alter the band structure and bandgap energy (remaining at 3.2 eV). The mechanism underlying the increased water splitting activity is discussed in relation to occupation of the B site by In³⁺ cations.",2019/2,Hanggara Sudrajat
141,"Janice Wang, Jeerawat Chuachan, Kritsana Patanaprasitchai, Jakkapon Phanthuwongpakdee, Tatsuo Kaneko, Kenji Takada, Sandhya Babel", ,"In the past recent years, the rapid expansion of industrialization has led to the release of metal pollution in water. Copper and aluminium are considered as hazardous metal that could poison the aquatic animals and human. To reduce this problem, the metal removal was conducted using the water-soluble bio-based polyimide (PI-COOK). The polymer was used to bind to the metal to create metal complexes; PI-COOCu and PI-COOAl. In this way, it also helps in removing metal from the contaminated water. EDX and FTIR analyses were employed for the elemental composition and functional-group analysis, respectively. The metal removal efficiency increased with the concentration of PI, and the maximum removal time is 12 h. PICOOK exhibited a higher complexation toward the increased concentration of Cu rather than Al. The fitting of kinetic models shows that PI-COOCu and PI-COOAl fit well with the second order …",2019,Bio-Based Polyimide for Metal Ions Removal from Aqueous Solution
142,"Dikshya Dhakal, Sandhya Babel", ,"Groundwater contaminated by arsenic pose a great threat to the environment. This work investigated the efficiency of easily available and non-toxic waste such as egg shell and banana peel to treat arsenic contaminated water. Egg shell and banana peel were characterized by FTIR to see the functional group responsible for adsorption. Batch experiments were separately carried to find the removal efficiencies of two forms of arsenic: arsenite and arsenate. The effects of various parameters, like dose of adsorbent, pH, retention time, agitation speed and initial analyte concentration were investigated. The maximum arsenic adsorption was found for 2mg/L solution by egg shell with a dose of 6 g/L. 68.54 % of As(III) was adsorbed at pH 9 at an equilibrium time of 160 min while 72.01 % of As(V) was adsorbed at pH 6 at an equilibrium time of 80 min. Hence it was observed that the presence of calcium carbonate and …",2018/1/1,Locally available material as adsorbent to treat arsenic contaminated water
143,"Aukrawut Seenuan, Thatapol Charoensukpatana, Natcha Chamchoy, Ngo Anh Dao Ho, Sandhya Babel", ,"There are many conventional technologies used for recovery of precious metals from wastewater, but most of them are chemical intensive and consume high energy. This paper focuses on silver recovery using bio-electrochemical system (BES), which basically consists of two separated chambers, the anode and cathode chamber. The anolyte, containing either acetate or glucose as substrate, was fed into the anode chamber, in which microorganisms were employed to produce electrons through anaerobic oxidation. The catholyte was a synthetic mixed metals solution containing silver Ag (I), copper Cu (II), and iron Fe (III), which acted as terminal electron acceptors. Two BES reactors, in which anion exchange membrane (AEM) and a cation exchange membrane (CEM) served as separators, were investigated. Experiments were conducted at different initial Fe (III) concentrations (10 mM and 20 mM), while the concentrations of Ag (I)(10 mM), and Cu (II)(1 mM), were kept constant. The silver recovery obtained in the CEM-based reactor (> 99%) was higher than that in AEM-based reactor (58-75%). However, diffusion of Ag (I), Fe (III), and Cu (II) through the CEM was unavoidable. In terms of power generation, a power density of 4515.63 mW/m3 was found in AEM-based reactor, which was higher than that in CEM-based reactor (1542.56 mW/m2). However, the substrate loss was found in the AEM-based reactor due to the transport of negative-charged organic matter through the AEM, which caused a fast decrease of cell voltage. This study successfully demonstrated the feasibility of using a bio-electrochemical system to recover silver coupled with …",2017/12/1,Recovery of Silver from Mixed Metals Solution Using a Bio-Electrochemical System
144,S Babel, , ,2017, 
145,"Irfan Mahmood, Shahid Nadeem Qureshi, Shahina Tariq, Gul Muhammad, Munir Ahmed Khan, Muhammad Zafar, Wasim Arshad, Ali Mustafa", ,"This study pertains to interpretation of Missa Keswal area and identify the structures, source and reservoir formations and whether or not faulting prevailed in the reservoir formations. Six seismic lines were interpreted for the purpose. The four dip lines are oriented SE-NW whereas two strike lines are oriented NE-SW. Three reflectors namely Sakesar Limestone, Khewra Sandstone and Salt Range Formation of Eocene, Cambrian and Precambrian age have been selected and identified. Faults showing thrusting are also identified within these Formations. The root mean square velocities (Vrms), given in the velocity windows on the seismic section, were used to calculate average velocities and depth of the Formations. Seismic Interpretation of 2D data shows that the area was deformed by compressional tectonics and the structures were formed during two main episodes of deformation-initial normal faulting and subsequent thrusting. The structures are tightly folded and complexly faulted. Major thrusts and back thrusts bound the anticlinal and synclinal features. The Sakesar Limestone is present at a depth between 1700-3500 meters, Khewra Sandstone between 3500–4900 meters, whereas the depth of Salt Range Formation varies from 4300–5500 meters. The results show that the basement normal faults have influenced the above lying structures and the thrust and back faults in the area are due to compressional movements from northeast to southwest. The Sakesar and Khewra formations are continuous throughout the area and therefore, are good reservoirs of hydrocarbons",2016/11/30,"Structural Interpretation of Missa Keswal Area, Potwar, Pakistan"
146,"Sandhya Babel, Hanggara Sudrajat, Ajay Aby Abraham", ,"Mn-and Fe-doped ZnO are synthesized by modified sol-gel method. The as-synthesized catalysts are characterized by Fourier transform infrared (FTIR) spectroscopy, scanning electron microscopy (SEM) and energy dispersive X-ray (EDX) spectroscopy. Their photocatalytic activity is investigated for the degradation of methylene blue (MB) and amaranth (AM) under UVA and visible light. The results show that the doping of Mn and Fe generally leads to enhanced photocatalytic activity. However, compared to Fe-doped ZnO, pristine ZnO prepared from zinc acetate (acet-ZnO) shows better performances. For instance, using 1 g/L of catalyst under UVA light, the MB degradation with acet-ZnO and Fe-ZnO are 98 and 43% in 90 min at pH 7, respectively. Adsorption of dye insignificantly contributes to the dye removal. Less than 5% of dyes are adsorbed within 2 h in the absence of light. Furthermore, Mn doping is more effective in enhancing the photocatalytic activity. UVA is found to be a better light source for all the catalysts. Using UVA light, 5 mol% Fe-ZnO with concentration of 1 g/L can degrade 93% of AM in 90 min at pH 7. Using visible light under identical experimental conditions, 10 mol% Mn-ZnO gives 50% efficiency for the AM degradation. In all the cases using doped ZnO, the dye degradation increases with increasing catalyst concentration and irradiation time and decreases with increasing dye concentration. Increasing pH generally increases the dye degradation up to an optimum value. Moreover, the MB and AM degradation by Fe-ZnO under visible light mainly occurs through a self-sensitization mechanism instead of oxidation by reactive …",2016/11/30,Manganese-and Iron-Doped Zinc Oxide for Photocatalytic Degradation of Recalcitrant Dyes
147,"Nguyễn Thị Phương Loan, Sandhya Babel, Alice Sharp, Đại học Thammasat, Thai Lan", ,"Quản lý chất thải rắn không phù hợp gây ra các tác động rất lớn đến môi trường (nước, không khí, và đất), ảnh hưởng đến sức khỏe con người cũng như lãng phí nguồn tài nguyên. Số lượng chất thải rắn phát sinh ở các nước đang phát triển có tốc độ đô thị hóa nhanh đã tăng lên rất đáng kể trong những năm qua.
Việt Nam là một trong số các quốc gia có tốc độ phát triển kinh tế nhanh nhất tại khu vực Đông Nam Á, cũng như thuộc nhóm các nước phát triển kinh tế cao nhất thế giới. Bên cạnh việc phát triển kinh tế nhanh, Việt Nam được xếp hạng 14 trong nhóm các quốc gia đông dân nhất trên thế giới với dân số khoảng 95 triệu người trong năm 2017. Thành phố Hồ Chí Minh (Tp. HCM) là một đô thị đặc biệt và là một trung tâm về kinh tế, văn hóa, giáo dục đào tạo, và khoa học công nghệ của Việt Nam. Tổng diện tích hành chính của Tp. HCM là 2.095 km2, bao gồm 24 quận/huyện trong đó có 19 quận nội thành và 5 huyện ngoại thành với dân số trên 9 triệu người. Từ năm 1992 đến 2016, khối lượng chất thải rắn phát sinh đã tăng rất nhanh từ 1.164 tấn/ngày lên 8.300 tấn/ngày. Hiện nay hệ thống quản lý chất thải rắn tại Tp. HCM chưa thật sự hiệu quả theo đó các vấn đề khó khăn gặp phải là thiếu nhân sự có năng lực, thiếu cơ sở hạ tầng kỹ thuật đối với tái chế, thu gom, vận chuyển và xử lý chất thải rắn và phân loại chất thải tại nguồn chưa được thực hiện trên toàn thành phố. Vì thế việc xây dựng một hệ thống quản lý chất thải rắn bền vững phù hợp với điều kiện của địa phương trở nên rất quan trọng và cấp bách.",2016,"Lựa chọn công nghệ trong Quản lý chất thải rắn bền vững Nghiên cứu điển hình tại Thành phố Hồ Chí Minh, Việt Nam"
148,"Putri A Sekartaji, Sandhya Babel", ,"Humic acid (HA) is universally present in soils and natural water resources in a yellow-brown form. HA can react with chlorine during drinking water treatment and produce disinfection byproducts (DBPs), such as trihalomethanes (THMs) and haloacetic acids (HAAs), which are harmful for health. Therefore, HA has to be eliminated from water environment. The photocatalysis is an effective alternative solution for the degradation of HA in a water environment. This research aims to degrade HA from water environment. The rapid degradation of HA, using zinc oxide nanoparticles, irradiated by ultraviolet light (ZnO/UV), is investigated. The optimum conditions of pertinent factors, which include the light wavelength (UV-A and UV-C), and light intensity, HA concentration, ZnO dose, and contact time are investigated at neutral pH conditions, considered for drinking water treatment. HA degradation efficiency reached more …",2016,Humic Acid Degradation by ZnO Photocatalyst
149,"Xaysackda Vilaysouk, Sandhya Babel", ,"Globally, the greenhouse gas (GHG) emission released from municipal solid waste (MSW) management sector contributes to 3% of total. Finding applicable solution for MSW management, along with reducing the GHG emission, are proposed in study. Luangprabang (LPB) is the world heritage city and one the most popular destination for tourism. In 2011, approximately 24.82 Gg/year MSW was generated. Landfill is the main disposal method of MSW generated in LPB. By using the International Panel on Climate Change 2006 (IPCC 2006) model, and Atmospheric Brown Clouds Emission Inventory Manual (ABC EIM), total of 19,735 tonnes/year CO2-eq is estimated to be generated from existing MSW management in LPB. Improvement of MSW management, by increasing the MSW collection service, introducing composting and recycling, and avoiding the open burning could play an important role to reduce environmental impacts. The GHG reduction was 45% in scenario S3 compared to scenario S1, and the GHG emission per capita was also lowest in scenario S3.",2015/5/19,"CO-BENEFITS OF IMPROVED MUNICIPAL SOLID WASTE MANAGEMENT IN LUANGPRABANG, LAO PDR"
150,"P Limpiteeprakan, S Babel", ,"The concentrations of silver in nineteen samples ranged from 0.052 to 6.348 µg/g of product. The highest content was found in the body suit in which silver wires were visible. The concentration was in the same range when compare to synthetic nanosilver fabric. When confirmed the result with SEM-EDX analysis, two samples were found to have silver on the surface of fibers. The diameter is approximately around 5.0 µm (500 nm), which is larger than the nanosize (1-100 nm). In three samples, titanium was found on fibers and surface of the samples and also found in eight ash samples. The leaching results from nano-Ag fabrics with deionized water were found in range of 146 to 229 µg/L. Type of liquid coming in contact with materials containing nanosilver, may have impact on amount of nanosilver leached and this should be investigated further. The concentration range in the product found from this study showed the potential risk of nanosilver releasing during use phase or disposal phase, especially in Thailand, where solid waste is mainly disposed on the landfill. The fate of nanosilver during disposal phase under landfill is outlined as an area that requires more study.",2013,Waste Management & Resource Utilisation
151,"Jenjira SAETANG, Sandhya BABEL", ,"Sauf mention contraire ci-dessus, le contenu de cette notice bibliographique peut être utilisé dans le cadre d’une licence CC BY 4.0 Inist-CNRS/Unless otherwise stated above, the content of this bibliographic record may be used under a CC BY 4.0 licence by Inist-CNRS/A menos que se haya señalado antes, el contenido de este registro bibliográfico puede ser utilizado al amparo de una licencia CC BY 4.0 Inist-CNRS",2012,"'ADVANCED TREATMENT TECHNOLOGIES FOR WASTE RECYCLING': SELECTED PAPERS FROM THE'INTERNATIONAL CONFERENCE ON SOLID WASTE―MOVING TOWARDS SUSTAINABLE RESOURCE MANAGEMENT', 2―6 …"
152,"Sandhya Babel, Einstine M Opiso", ,"The potential of using Andisols to remove Cr (VI) from aqueous solution was evaluated by batch and column experiments. The results showed that the A-horizons (Isarog: 63%; Mandalagan: 42%) of the soils have lower adsorption capacity compared to B-horizons (Isarog: 93%; Mandalagan: 66%) using a dose of 20 g/L and Cr (VI) concentration of 10 mg/L. The adsorption capacity of B-horizons using column experiments were also found to retain more Cr (VI) than batch technique. Hence, the B-horizon of the studied Andisols can be used as an effective adsorbent for Cr (VI) removal from contaminated water systems.",2010/1/1,Utilisation of Andisols as possible low-cost adsorbent to remove Cr (VI) from aqueous solution
153,"BA Shah, AV Shah, RR Singh", , ,2009, 
154,"Sandhya Babel, Alice Sharp, Amornpong Thongbhakdi, Zebunnessa Shoma", ,"Bang-Pa canal located in Ratchaburi province is a natural waterway passing through different communities with its various usages. An alteration in canal’s geography due to the development of industrial estate coupled with the pollutant discharges by upstream community has hindered the use of canal water for the downstream community who depends on the canal most. This research project is carried out to mobilize stakeholder’s participation on environmental issues of Bang Pa canal. It involves capacity building of the community in water quality conservation through water quality monitoring and biological assessment using macroinvertebrates. For this, 60 volunteers from four sub-districts were actively involved. The integrated results of water quality and macroinvertebrates analysis show that the upstream water quality of the Bang-Pa canal is better as depicted by physico-chemical and biological parameters (water quality index). As the canal passes through the community, the quality deteriorates as the polluted water flows into the canal through alternative paths. The activities of the project have been integrated with the ongoing environmental efforts of the villagers on the conservation of the canal to maximize the effect. The involvement of local administration was rated as satisfactory by the community towards the issues of the canal. However, participation especially from the women residents is further required for conservation of water quality.",2008/10/23,Community Participation in Pollution Abatement and Water Quality Conservation through Bio Monitoring
155,"Dominica del Mundo Dacera, Sandhya Babel", ,"Heavy metals in sewage sludge can pose a long term environmental risk due to their toxicity,",2007/12/12,Assessment of heavy metal removal efficiencies by naturally fermented and a. niger fermented pineapple wastes from contaminated sewage sludge
156,"Sandhya Babel, Shabbir Hussaini Gheewala, UG Abeysundara", ,"This paper compares the environmental, economic and social impacts of two types of roofs (elements) widely used for buildings in Sri Lanka, namely tile and asbestos, taking into consideration a life cycle perspective. Environmental burdens associated with these elements are analyzed in terms of embodied energy along with the environmental impacts such as global warming, acidification and nutrient enrichment. Economic analysis based on market prices of materials and social analysis based on interviews are also carried out. It was found that asbestos elements are superior to tile elements for environmental scores acidification, nutrient enrichment and embodied energies. However, the global warming of the asbestos elements is a little higher. On economic and social scores also asbestos elements perform better. This analysis will help in the decision-making process when selecting materials for these elements.",2007,A decision making matrix with life cycle perspective of materials for roofs in Sri Lanka
