,authors,cite_by,description,publication_date,tittle
0,"Sandhya Babel, Tonni Agustiono Kurniawan",4013,"In this article, the technical feasibility of various low-cost adsorbents for heavy metal removal from contaminated water has been reviewed. Instead of using commercial activated carbon, researchers have worked on inexpensive materials, such as chitosan, zeolites, and other adsorbents, which have high adsorption capacity and are locally available. The results of their removal performance are compared to that of activated carbon and are presented in this study. It is evident from our literature survey of about 100 papers that low-cost adsorbents have demonstrated outstanding removal capabilities for certain metal ions as compared to activated carbon. Adsorbents that stand out for high adsorption capacities are chitosan (815, 273, 250 mg/g of Hg2+, Cr6+, and Cd2+, respectively), zeolites (175 and 137 mg/g of Pb2+ and Cd2+, respectively), waste slurry (1030, 560, 540 mg/g of Pb2+, Hg2+, and Cr6+, respectively …",2003/2/28,Low-cost adsorbents for heavy metals uptake from contaminated water: a review
1,"Tonni Agustiono Kurniawan, Gilbert YS Chan, Wai-Hung Lo, Sandhya Babel",1973,"This article reviews the technical applicability of various physico–chemical treatments for the removal of heavy metals such as Cd(II), Cr(III), Cr(VI), Cu(II), Ni(II) and Zn(II) from contaminated wastewater. A particular focus is given to chemical precipitation, coagulation–flocculation, flotation, ion exchange and membrane filtration. Their advantages and limitations in application are evaluated. Their operating conditions such as pH, dose required, initial metal concentration and treatment performance are presented. About 124 published studies (1980–2006) are reviewed. It is evident from the survey that ion exchange and membrane filtration are the most frequently studied and widely applied for the treatment of metal-contaminated wastewater. Ion exchange has achieved a complete removal of Cd(II), Cr(III), Cu(II), Ni(II) and Zn(II) with an initial concentration of 100 mg/L, respectively. The results are comparable to that of …",2006/5/1,Physico–chemical treatment techniques for wastewater laden with heavy metals
2,"Sandhya Babel, Tonni Agustiono Kurniawan",948,"In this study, the technical feasibility of coconut shell charcoal (CSC) and commercial activated carbon (CAC) for Cr(VI) removal is investigated in batch studies using synthetic electroplating wastewater. Both granular adsorbents are made up of coconut shell (Cocos nucifera L.), an agricultural waste from local coconut industries. Surface modifications of CSC and CAC with chitosan and/or oxidizing agents, such as sulfuric acid and nitric acid, respectively, are also conducted to improve removal performance. The results of their Cr removal performances are statistically compared. It is evident that adsorbents chemically modified with an oxidizing agent demonstrate better Cr(VI) removal capabilities than as-received adsorbents in terms of adsorption rate. Both CSC and CAC, which have been oxidized with nitric acid, have higher Cr adsorption capacities (CSC: 10.88, CAC: 15.47 mg g−1) than those oxidized with …",2004/2/1,Cr (VI) removal from synthetic wastewater using coconut shell charcoal and commercial activated carbon modified with oxidizing agents and/or chitosan
3,"Tonni Agustiono Kurniawan, Gilbert YS Chan, Wai-hung Lo, Sandhya Babel",804,"In this article, the removal performance and cost-effectiveness of various low-cost adsorbents derived from agricultural waste, industrial by-product or natural material are evaluated and compared to those of activated carbon for the removal of heavy metals (Cd(II), Cr(III), Cr(VI), Cu(II), Ni(II) and Zn(II)) from metals-contaminated wastewater. To highlight their technical applicability, selected information on pH, dose required, initial metal concentration, adsorption capacity and the price of the adsorbents is presented. It is evident from the survey of 102 published studies (1984–2005) that low cost adsorbents derived from agricultural waste have demonstrated outstanding capabilities for the removal of heavy metal (Cr(VI): 170 mg/g of hazelnut shell activated carbon, Ni(II): 158 mg/g of orange peel, Cu(II): 154.9 mg/g of soybean hull treated with NaOH and citric acid, Cd(II): 52.08 mg/g of jackfruit), compared to activated …",2006/8/1,Comparisons of low-cost adsorbents for treating wastewaters laden with heavy metals
4,"Zümriye Aksu, Sevilay Tezer",584,"The biosorption of Remazol Black B, a vinyl sulphone type reactive dye, from aqueous solutions on dried Rhizopus arrhizus was studied in a batch system with respect to the temperature, initial pH and initial dye concentration. The fungal biomass exhibited the highest dye uptake capacity at 35°C, at the initial pH value of 2.0 and at the initial dye concentration of 800 mg l−1. The Freundlich and Langmuir adsorption models were used for the mathematical description of the biosorption equilibrium and isotherm constants were evaluated at different temperatures. Equilibrium data fitted very well to the Freundlich model in the studied concentration (20–800 mg l−1) and temperature (25–55°C) ranges. The pseudo first- and second-order kinetic models were also applied to the experimental data assuming that the external mas transfer limitations in the system can be neglected and biosorption is chemisorption controlled …",2000/12/1,Equilibrium and kinetic modelling of biosorption of Remazol Black B by Rhizopus arrhizus in a batch system: effect of temperature
5,"Sandhya Babel, Dominica del Mundo Dacera",340,"In recent years, various methods for heavy metal removal from sewage sludge have been extensively studied in order to minimize the prospective health risks of sludge during land application. In this paper, a comparative review and critical analysis of the application of chemical extraction, bioleaching, electroreclamation, and supercritical fluid extraction (SFE), in removing heavy metals from contaminated sludges is presented. Moreover, speciation studies, which can indicate ease of leachability of the different forms of heavy metals in sludge, are also presented. Experimental studies revealed a broad range in metal extraction efficiencies of the different extraction technologies. Acid treatment seemed to effectively remove Cd, attaining as much as 100% removal for some studies, as compared to bioleaching. SFE also gave higher removal efficiency than bioleaching. Cr, Pb and Ni seemed to be also effectively …",2006/1/1,Heavy metal removal from contaminated sludge for land application: a review
6,"Sandhya Babel, Satoshi Takizawa",169,"This study was carried out to investigate the membrane fouling phenomena due to algal deposition and to understand the nature of the cake deposited on the membrane while treating the algae-laden water by membrane filtration. To accomplish this, batch experiments in dead end mode were carried out using Chlorella algae to investigate the effect of feed concentration and transmembrane pressure (TMP) on cake resistance using cellulose ester and polyvinylidene difluoride (PVDF) membranes. It was found that algae can cause significant fouling of both the cellulose ester and PVDF membranes. Fouling due to algae is quite complex because these cells release extracellular organic matter (EOM) which significantly increases the resistance. The cake resistance offered by the Chlorella algae was independent of the membrane materials considered; thus the interaction between the membrane material and …",2010/10/15,Microfiltration membrane fouling and cake behavior during algal filtration
7,"UG Yasantha Abeysundara, Sandhya Babel, Shabbir Gheewala",152,"This paper presents a matrix to select sustainable materials for buildings in Sri Lanka, taking into consideration environmental, economic and social assessments of materials in a life cycle perspective. Five building elements, viz., foundations, roofs, ceilings, doors and windows, and floors are analyzed based on materials used for these elements. Environmental burdens associated with these elements are analyzed in terms of embodied energy and environmental impacts such as global warming, acidification and nutrient enrichment. Economic analysis is based on market prices and affordability of materials. Social factors that are taken into account are thermal comfort, interior (aesthetics), ability to construct quickly, strength and durability. By compiling the results of analyses, two building types with minimum and maximum impacts are identified. These two cases along with existing buildings are compared in a matrix …",2009/5/1,A matrix in life cycle perspective for selecting sustainable materials for buildings in Sri Lanka
8,"Sandhya Babel, Kensuke Fukushi, Bunpot Sitanrassamee",143,"Laboratory scale experiments were carried out to evaluate and determine the suitable working conditions for the enhancement of volatile fatty acids (VFAs) production with the stabilization of solid pineapple waste (peel) simultaneously when operating two-phase anaerobic digestion. It was found that acid production, enhanced when the digester was operated at neutral pH. VFAs, could be obtained at about 50 g/kg-waste within 14 days when operating at pH 6.5–7.5 compared to 33 g/kg-waste for digester operated at pH 5.0–6.0 for 32 days. The total volatile solid reduction of 42–48% was obtained with a 51–57% volume reduction at neutral pH. The effect of undissociated acids on the activity of acetogenic bacteria was also studied. The inhibitory level of undissociated acids for acidogenesis was found to be about 2300, 650, and 120 mg/L at pH 5, 6, and 7, respectively. The results revealed that at low pH …",2004/5/1,Effect of acid speciation on solid waste liquefaction in an anaerobic acid digester
9,"Sandhya Babel, Satoshi Takizawa, Hiroaki Ozaki",113,"A seasonal fluctuation pattern was observed in membrane filtration resistance by Chlorella algae cultured in open ponds in the tropical environment. In order to investigate the causes of this phenomenon, Chlorella was cultivated under controlled conditions and the cake resistance was measured by batch filtration in dead-end mode. The filtration resistance was found to be a function of environmental conditions. Algae could grow favourably and offered low specific cake resistance (Rcs) on the order of 1011 m/g for the culture temperature from 28°C to 35°C. The algal growth was inhibited and the specific cake resistance increased to the order of 1012 m/g below or above this optimum temperature range. Strong solar radiation, coupled with high temperatures, also inhibited the growth of algae and resulted in higher specific cake resistance. The specific cake resistance of algae cultured at different temperatures …",2002/3/1,Factors affecting seasonal variation of membrane filtration resistance caused by Chlorella algae
10,"Sandhya Babel, Einstine M Opiso",108,"The possibility of using volcanic ash soils (VAS) or Andisols as a low-cost and natural adsorbent is investigated in this study for the removal of Cr (VI) from synthetic wastewater. Andisols can be used as adsorbent because they are characterized by the presence of non-crystalline secondary minerals such as allophane and imogolite that show variable charge characteristics and have the ability to retain cations and anions. The adsorption of Cr on to two VAS from Mt. Isarog and Mandalagan (B-Horizon), Philippines, was carried out at ambient temperature using batch adsorption studies. The effects of different parameters such as amount of adsorbent, contact time, initial Cr concentration and pH of the solution were investigated. The results showed that the VAS from Isarog is more effective in the removal of Cr than in Mandalagan. The maximum removal efficiency of the Isarog soil for a Cr concentration of …",2007/12/1,Removal of Cr from synthetic wastewater by sorption into volcanic ash soil
11,"Sandhya Babel, Jenjira Sae-Tang, Athapol Pecharaply",91,"In Thailand, sewage sludge production from the Bangkok metropolitan area can reach up to 63,000 ton/y by 2010. The Beer-Thai Company, Thailand, produces beer and generates lots of sludge as waste. Sewage sludge and brewery sludge can be used to generate energy which could be saved on the fossil fuels conventionally used as a source of energy. The possibility was explored to mix brewery sludge with sewage sludge at different mixing ratios for anaerobic digestion so that the energy can be generated as biogas and at the same time, digested sewage sludge can be used as fertilizer for agricultural applications. A batch anaerobic reactor under mesophilic condition for a digestion period of 40 days was used in the laboratory. The acrylic reactor was cylindrical with a working weight of 12 kg. The diameter was 23.7 cm and the height was 34.5 cm. Sludge mixtures at different ratios were fed into the …",2009/12/1,Anaerobic co-digestion of sewage and brewery sludge for biogas production and land application
12,"Hanggara Sudrajat, Sandhya Babel, Hiroshi Sakai, Satoshi Takizawa",82,"A novel N-doped ZrO2 (N–ZrO2) photocatalyst is synthesized through thermal decomposition of zirconium hydroxide-urea complex and is characterized using various techniques, including XRD, FTIR, TGA, SEM, TEM, UV-DRS, XPS, XANES, and BET. The N–ZrO2 possesses pure monoclinic structure with high crystallinity. By using the proposed facile route of synthesis, both interstitial and substitutional N doping with high dopant stability can be realized. The optical properties of the catalyst are significantly altered after N doping, giving an optical response in the visible and near infrared regions and an additional strong absorption peak in the UVA region. The N–ZrO2 showed a higher photocatalytic activity than pristine ZrO2 for the degradation of amaranth (AM) and methylene blue (MB) under visible or UV light irradiation, which could be attributed to the band gap narrowing, higher specific area, smaller crystalline …",2016/1/1,Rapid enhanced photocatalytic degradation of dyes using novel N-doped ZrO2
13,"Ö Genç, L Soysal, G Bayramoğlu, MY Arıca, S Bektaş",76,"The effective removal of toxic heavy metals from environmental samples still remains a major topic of present research. Metal-chelating membranes are very promising materials as adsorbents when compared with conventional beads because they are not compressible, and they eliminate internal diffusion limitations. The purpose of this study was to evaluate the performance of a novel adsorbent, Procion Green H-4G immobilized poly(hydroxyethylmethacrylate (HEMA)/chitosan) composite membranes, for the removal of three toxic heavy metal ions, namely, Cd(II), Pb(II) and Hg(II) from aquatic systems. The Procion Green H-4G immobilized poly(hydroxyethylmethacrylate/chitosan) composite membranes were characterized by elemental analysis, scanning electron microscopy and Fourier transform infrared (FTIR) spectroscopy. The immobilized amount of the Procion Green H-4G was calculated as 0.018±0.003 …",2003/2/28,Procion Green H-4G immobilized poly (hydroxyethylmethacrylate/chitosan) composite membranes for heavy metal removal
14,"S Babel, TA Kurniawan",68,"Contamination of groundwater due to toxic heavy metals, such as As and Hg, is of international concern. In this paper, the technical feasibility of some technologies to treat metalcontaminated groundwater is reviewed. All data presented are quoted from the original sources. It is conclusively evident from the literature survey that low cost technology, like adsorption, can demonstrate excellent metal removal capabilities comparable to reverse osmosis. Due to chemical modification, adsorption using inexpensive materials, such as coconut husk carbon, can remove As (III) with metal adsorption capacity of 159 mg/g. This high adsorption capacity suggests that adsorption treatment technique is capable of reducing a residual arsenic concentration to 10 µg/l, which is the maximum discharge limit set by the US EPA (Environmental Protection Agency). In spite of the availability of various technologies to treat metal-contaminated groundwater, the suitability of a selected technology for such a purpose depends on the initial metal concentration, the residual metal concentration required, the removal performance on heavy metal compared to other technologies, and the overall treatment cost.",2005/12/1,Various treatment technologies to remove arsenic and mercury from contaminated groundwater: an overview
15,"Sandhya Babel, Satoshi Takizawa",64,"Batch filtration experiments in dead-end mode were carried out to investigate the membrane fouling phenomenon while treating algal-laden water with and without pretreatment. The three types of water samples used were dispersed Chlorella laden water, chemically conditioned Chlorella algae, and natural water from pond. Chemical pretreatment was done using alum and ozone. It was found that algae can cause significant fouling of membranes. For dispersed Chlorella algae, initially when the deposition was less, the resistance was very low or negligible. As the deposition increased, the resistance increased exponentially and then a linear increase was observed. The cake resistance was found to be 1.23 × 1013/m for an algal deposition of 9.6 g/m2. The cake resistance offered by chemically conditioned Chlorella sample was half, as compared to that of the dispersed sample for the same amount of deposition …",2011/7/1,Chemical pretreatment for reduction of membrane fouling caused by algae
16,"Indika Thushari, Sandhya Babel",63,"In this study, an inexpensive, environmental benign acid catalyst is prepared using coconut meal residue (CMR) and employed for biodiesel production from waste palm oil (WPO). The total acid density of the catalyst is found to be 3.8 mmolg−1. The catalyst shows a unique amorphous structure with 1.33 m2 g−1 of surface area and 0.31 cm3 g−1 of mean pore volume. Successful activation is confirmed by Fourier transform infrared (FT-IR) spectroscopy and X-ray photoelectron spectroscopy (XPS). The highest biodiesel yield of 92.7% was obtained from WPO in an open reflux system using the catalyst. Results show that biodiesel yield increases with increasing methanol:oil (molar ratio) and reaction time up to an optimum value. It is found that the catalyst can be reused for at least four cycles for >80% biodiesel yield. Fuel properties of the produced biodiesel meet international biodiesel standards.",2018/1/1,Sustainable utilization of waste palm oil and sulfonated carbon catalyst derived from coconut meal residue for biodiesel production
17,"TA Kurniawan, S Babel",63,"In this study, the technical feasibility of using CSC, zeolite, and CAC for chromium removal from contaminated wastewater was investigated using batch studies at varying chromium concentrations (5, 10, 20, and 25 mg/l). The granular CSC and CAC were made up of coconut shell, an agricultural waste from the local coconut industries in Thailand. The results of their removal performances in as-received forms are compared to each other. It was evident that between the two low-cost adsorbents, CSC has a higher chromium removal capability (2.18 mg/g) than zeolite (1.79 mg/g), while CAC demonstrated an outstanding adsorption capacity (4.72 mg/g). In fact, the adsorption capacity of CSC at 5 mg/l of chromium concentration is comparable (4.30 mg/g) to that of CAC (4.72 mg/g) at 20 mg/l. It is important to note that the adsorption capacities of adsorbents varied, depending on the characteristics of the individual adsorbent and the initial concentration of chromium.",2003/2,A research study on Cr (VI) removal from contaminated wastewater using low-cost adsorbents and commercial activated carbon
18,"K Fukushi, Sandhya Babel, S Burakrai",62,"The presence of pathogenic microorganisms in municipal waste sludge may create a serious outbreak of water borne diseases if the sludge is used for agricultural purpose. An attempt to decrease the number of pathogenic microorganisms, Salmonella spp. using a simulated acid-phase anaerobic digester was tested in a laboratory-scale batch experiment. Reduction of Salmonella spp. was demonstrated in a mixture of sludge and organic acid, simulating an acid digester of a two-phase anaerobic digestion process. A high concentration of organic acid at a pH value of 5.5–6.0 prevents a decrease in Salmonella spp. concentration. Almost complete destruction of Salmonella spp. is observed within two days if the pH value is maintained below 5.5.",2003/1/1,Survival of Salmonella spp. in a simulated acid-phase anaerobic digester treating sewage sludge
19,"Dominica Del Mundo Dacera, Sandhya Babel",60,"The environmental benefits derived from using citric acid in the removal of heavy metals from contaminated sewage sludge have made it promising as an extracting agent in the chemical extraction process. At present, citric acid is produced commercially by fermentation of sucrose using mutant strains of Aspergillus niger (A. niger), and chemical synthesis. In recent years, various carbohydrates and wastes (such as pineapple wastes) have been considered experimentally, to produce citric acid by A. niger. This study investigated the potential of using A. niger fermented raw liquid from pineapple wastes as a source of citric acid, in extracting chromium (Cr), copper (Cu), lead (Pb), nickel (Ni) and zinc (Zn) from anaerobically digested sewage sludge. Results of the study revealed that metal removal efficiencies varied with pH, forms of metals in sludge and contact time. At pH approaching 4, and contact time of 11 days, A …",2008/4/1,Removal of heavy metals from contaminated sewage sludge using Aspergillus niger fermented raw liquid from pineapple wastes
20,"Chayarat Tantanasarit, Andrew J Englande, Sandhya Babel",54,"Nitrogen, phosphorus, and silicon uptake rates under very high nutrient concentration were investigated by culturing Chaetoceros calcitrans in varying nitrite and nitrate–nitrogen (NO2− + NO3−-N), phosphate–phosphorus (PO43 −-P), and silicate–silicon (Si(OH)4-Si) concentrations to understand nutrient uptake kinetics. Uptake rates were evaluated by using the classic Michaelis–Menten equation. Maximum uptake rates (ρmax) of 0.0529, 0.0088, and 0.0150 pmol/cell/h, and half-saturation constants (Ks) of 623, 133, and 71 μm were determined for NO2− + NO3−-N, PO43 −-P and Si(OH)4-Si, respectively. Results of this study indicate that under very high nutrient concentrations, C. calcitrans can effectively reduce nutrients from the surrounding waters. These nutrients are accumulated within intracellular vacuoles as nutrient pools and assimilated by the cell later. Assimilation efficiencies for nitrogen, silicon, and …",2013/8/1,"Nitrogen, phosphorus and silicon uptake kinetics by marine diatom Chaetoceros calcitrans under high nutrient concentrations"
21,"Emmanuel P Leano, Alfredo J Anceno, Sandhya Babel",51,"Substrate bioavailabity is one of the critical factors that determine the relative biohydrogen (bioH2) yield in fermentative hydrogen production and bioelectricity output in a microbial fuel cell (MFC). In the present undertaking, batch bioH2 production and MFC-based biolectricity generation from ultrasonically pretreated palm oil mill effluent (POME) were investigated using heat-pretreated anaerobic sludge as seed inoculum. Maximum bioH2 production (0.7 mmol H2/g COD) and COD removal (65%) was achieved at pH 7, for POME which was ultrasonically pretreated at a dose of 195 J/mL. Maximum value for bioH2 productivity and COD removal at this sonication dose was higher by 38% and 20%, respectively, than unsonicated treatments. In batch MFC experiments, the same ultrasound dose led to reduced lag-time in bioelectricity generation with concomitant 25% increase in bioelectricity output (18.3 W/m3) and an …",2012/9/1,"Ultrasonic pretreatment of palm oil mill effluent: Impact on biohydrogen production, bioelectricity generation, and underlying microbial communities"
22,"EP Leaño, Sandhya Babel",49,"Batch production of biohydrogen from cassava wastewater pretreated with (i) sonication, (ii) OPTIMASH BG® (enzyme), and (iii) α-amylase (enzyme) were investigated using anaerobic seed sludge subjected to heat pretreatment at 105 °C for 90 min. Hydrogen yield at pH 7.0 for cassava wastewater pretreated with sonication for 45 min using anaerobic seed sludge was 0.913 mol H2/g COD. Results from pretreatment with OPTIMASH BG® at 0.20% and pH 7 showed a hydrogen yield of 4.24 mol H2/g COD. Superior results were obtained when the wastewater was pretreated with α-amylase at 0.20% at pH 7 with a hydrogen yield of 5.02 mol H2/g COD. In all cases, no methane production was observed when using heat-treated sludge as seed inoculum. Percentage COD removal was found to be highest (60%) using α-amylase as pretreatment followed by OPTIMASH BG® at 54% and sonication (40% reduction rate …",2012/3/1,Effects of pretreatment methods on cassava wastewater for biohydrogen production optimization
